<?xml version="1.0" encoding="UTF-8"?>
<!-- personas2.xml NO ES igual que personas.xml
     porque hay "diferencias" -->
<!DOCTYPE personas SYSTEM "personas.dtd">
<personas>
  <persona dni="12345678A" micolor="rojo" pais="&eeuu;">
	<nombrep>Miguel Martín</nombrep>
    <edad>37</edad>
    <password>abcdef33</password>
    <sueldo>1500.75</sueldo>
</persona>

<persona dni="33445566M" micolor="azul" pais="&spa;">
	<nombrep>María García</nombrep>
    <edad>31</edad>
    <password>pepito22</password>
    <sueldo>1850.00</sueldo>
</persona>

</personas>